{
  "schema_version": 1,
  "run_plan_id": "RP-EXAMPLE",
  "revision": 1,
  "status": "draft",
  "requirement": {
    "id": "REQ-EXAMPLE",
    "revision": 1,
    "path": "requirements/REQ-EXAMPLE.md",
    "sha256": "aaaaaaaaaaaaaaaaaaaaaaaaaaaaaaaaaaaaaaaaaaaaaaaaaaaaaaaaaaaaaaaa"
  },
  "document": {
    "id": "RP-EXAMPLE",
    "revision": 1,
    "path": "run-plans/RP-EXAMPLE.md",
    "sha256": "bbbbbbbbbbbbbbbbbbbbbbbbbbbbbbbbbbbbbbbbbbbbbbbbbbbbbbbbbbbbbbbb"
  },
  "phases": [
    {
      "phase_id": "PH-01",
      "title": "Implement",
      "status": "not_started",
      "tasks": [
        {
          "task_id": "TASK-01",
          "title": "Build the customization",
          "status": "not_started",
          "allowed_paths": ["custom_addons/context_menu/**"],
          "validation": ["Run the targeted Odoo tests."]
        }
      ]
    }
  ]
}
